title,selftext,subreddit
A wife sent her husband a romantic text message…,"She wrote: “If you are sleeping, send me your dreams. If you are laughing, send me your smile. If you are eating, send me a bite. If you are drinking, send me a sip. If you are crying, send me your tears. I love you.” 

Her husband texted back: “I’m on the toilet, please advise.”",dadjokes
Patient in hospital bed shouts to the doctor. Doctor Doctor I cant feel my legs!,I know that the doctor said; We have amputated your arms....,dadjokes
I asked my son if he had heard of Eddie Van Halen,"he said ""hmm, he rings a bell""

and I said ""No, he played guitar""",dadjokes
Scientists have recently recorded the sounds of two helium atoms laughing,HeHe,dadjokes
"At a clown’s funeral, everybody brought flowers.",There wasn’t a dry face in the house.,dadjokes
"When pressed by Biden in the debate about his Chinese bank account, Trump replied...",I lost Yuan,dadjokes
"When Biden pressed Trump about his Chinese bank account, Trump admitted...",I lost Yuan,dadjokes
Doctor - your body has ran out of magnesium!,Me - 0mg,dadjokes
Why are people in Moscow always so early to meetings?,Because they're Russian to them!,dadjokes
Gwen Stefani is just a girl.,There ain’t No Doubt about that!,dadjokes
Drilling holes is boring,"I’ll just see myself out, thanks.",dadjokes
Sorry I cant help.....,My hands are tide.,dadjokes
Did you know the toothbrush was invented in Tennessee?,If it had been invented any where else it would be called a teeth brush.,dadjokes
I just broke my finger...,"But on the other hand, I’m okay.",dadjokes
"What weighs more, a ton of feathers or a ton of bricks?",A ton of feathers. You have to carry the weight of what you did to those poor birds.,dadjokes
Guess who got better after all the shit they been together!!!!!,"*your ass cheeks* 
🤣",dadjokes
Did you know that lawyers are buried 12 feet deep when they die?,Apparently deep down they are good people.,dadjokes
What’s the difference between Northern Irish clock towers and clock towers from the rest of the world?,Northern Ireland have to ring the Belfast,dadjokes
Dad joke help!?,"Sorry if wrong place as this isn't a joke... 

My boss, king of dad jokes, is leaving and I'd like a farewell dad joke! 

Any smart jokes out there? 

IT manager if that helps ..",dadjokes
"Don't get too mad, but I AM trying to push your buttons here.","When I picked up the universal remote at the thrift shop,  I thought this changes everything. But I realized one of the volume buttons was broken. I bought it anyways, it only cost a penny. It was such a bargain I just couldn't turn it down.",dadjokes
What do you call it when people in Russia are split up?,Sergei-gation.,dadjokes
Warning: This post is NSFW,Standing on swivel chairs,dadjokes
I made a joke at the Zoo the other day and someone took offence...,I hope they put the fence back because some of the animals got out.,dadjokes
Doctor: Your body has run out of magnesium.,Me: 0mg,dadjokes
"For years, I thought I was using a premium-brand shampoo.",Turned out it was really just some fake shit.,dadjokes
I almost got in trouble because I tried to talk to someone in the same room as me over the phone...,...It was a close call.,dadjokes
"Climbing through my window on the first floor was easy. But if it was the second floor,",That'd be a different story all together.,dadjokes
"I was going crazy, looking around, trying to figure out who said ""heads up""",And that's when it hit me...,dadjokes
Why is North Korea so evil?,Because they have no Seoul.,dadjokes
What is a snail's least favorite condiment,Ketchup,dadjokes
There must be a huge percentage of con men named Conner,"So basically, stockbrokers.",dadjokes
On Halloween don't wear a dinosaur costume in bad neighborhoods.,You'll get Jurasskicked.,dadjokes
What did the cat say when he arrived in China?,Mi auw,dadjokes
Hmmm,"Me: I’ve heard a lot of restaurants are struggling to find cooking surfaces.
Friend: oh really why?
Me: because It’s a PANdemic",dadjokes
"Mama Frog was really struggling with her youngest, Little Hop. He couldn’t seem to sit still!","That is, at least not long enough to learn any of the many, many important things a frog needs to learn in order to be a frog. 

You see, a frog needs to be super slick in order to get by. A frog without proper skills, well, he may as well be a toad. 

Anyways, every time Mama Frog went about trying to teach Little Hop something, he would just bounce.. and bounce.. and bounce..

And every time Mama Frog had reached her limit of patience, right before giving up, she’d say to Little Hop, “If you keep on keepin’ on hoppin around all aimless, I’m gonna turn you into a toad!”

Which, upon hearing, Little Hop would stop his hop and settle. You see, he knew well enough that he wanted no part of being a toad.

Well, on one particular day, during one such lesson, Little Hop had taken again to  bouncing here, and bouncing there - and just about everywhere besides a place he could listen! And on this same particular day, Mama Frog’s patience was worn real, real, thin, you see, and she got sudden filled with a terrible frustration. 

And just like a firecracker went off, in a sudden snap, Mama Frog turned Little Hop straight into a toad! 

And when it was done, Mama Frog looked at him straight, shook her head, and said, “I toad you so.”",dadjokes
Why did the boat know it had a leak?, That sinking feeling...,dadjokes
"With the increasing cases of Covid in America, I was worried there would be a shortage of paper towels.",But I found the grocery story to be Bounty full.,dadjokes
I would never buy Velcro,It is a rip off,dadjokes
My freind,,dadjokes
Buzz Aldrin was the second man on the moon...,Neil before him.,dadjokes
I once read a book about WD-40.,It was in the non-friction section.,dadjokes
"Help, my car doesn't run!",The tires are rolling.,dadjokes
Two muffins are baking in the oven...,"The first muffin turns to the second and says ""Man it sure is hot in here.""
The second says ""AAAHHHHHH a talking muffin!!""",dadjokes
I love the occcccccean.,There's nothing like the seven c's.,dadjokes
How many vowels are in glasses?,"6.  A, e and 4 i's",dadjokes
Do Penguins Have Knees?,Or just Bee's Knees suits?,dadjokes
You can tell how people feel about your jokes by how they treat your gate.,"If they leave it alone, they like your jokes. If they steal it, they've taken a fence.",dadjokes
What did the encouraging girl spirit say to the other ambitious girl spirit?,“You ghost girl!”,dadjokes
"Hey kids, What do you call cheese that’s not your cheese?",Nacho cheese !! Hmhmmm,dadjokes
I met Hannibal Lecter's brother...,"I recently defaulted on a loan due to coronavirus and the bank sent Hannibal's brother to deal with me. And you know what? He was even WORSE than Hannibal, sending me threatening letters, calling me at work and at home, even showing up at my front door. Heck, he made old Hannibal seem like a pansy. His name??? Bilka... Bilka Lecter.",dadjokes
What do you call an abortion by orange juice?,A vitamin C-section :),dadjokes
"Two ninjas are sneaking up on their target when one of the ninjas asks the other: ""do you think you can hit him from here?"" and the ninja says:","""I shuriken""",dadjokes
What kind of bees produce milk?,BooBees,dadjokes
I heard that mixed race babies are really good looking.,So I enrolled both my kids in the hurdles and 100m sprint.,dadjokes
I'm a personal trainer for members of 1960's rock bands.,I'm still working out the Kinks.,dadjokes
I sold a couple ducks today,Pond em right off,dadjokes
"My wife told me to stop singing Smash Mouth songs, and at first I thought she was kidding.",But then I saw her face.,dadjokes
I hate camping,It’s always so in tents,dadjokes
What do you call pants that you don't wear right now?,Laterhosen.,dadjokes
Prisoner - I am sorry. I tried to escape,"Guard - I am not mad. I am just.....disappointed.

Moral - DONT LET YIUR GUARD DOWN",dadjokes
I wrote a song to memorialize the man killed when a piano fell down a mine shaft.,It's in A flat minor.,dadjokes
Why did the cowboy adopt a dachshund?,Someone told him to “get along little doggie”,dadjokes
I asked a blind girl out in braille today...,...she left me on felt,dadjokes
Why is California feel so down?,Because it got fired and can’t get any relief,dadjokes
When you borrow a chair,"I borrowed my daughter's desk chair for about ten minutes earlier today. As I was bringing it back I said  ""They say when you borrow someone's car you should return it with a full tank of gas...""
It took her about 3 seconds to reply ""Nooooo! Did you fart in my chair?""",dadjokes
"After countless hours, i doubled my artwork",Now i have arfourrk,dadjokes
I recently had a vasectomy but my wife still had a baby.,Apparently a side effect is that it changes your babies race they should look into that.,dadjokes
What is the difference between a cat and a compound statement?,One has claws at the end of its paws and the other has a pause and the end of its clause!,dadjokes
A man walks into a sperm bank,"The doctor says ""would you get a load of this guy?""",dadjokes
You guys wanna hear a dirty joke,So little jimmy was playing in some mud and he had to take a bath,dadjokes
Being archeologist is...,Just one way to dig life,dadjokes
A mouse and a PC walk into a bar.,They really clicked.,dadjokes
Who mods r/dadjokes?,The Dad Poet Society,dadjokes
Why haven't we talked about premature ejaculation.,Cuz its a sensitive topic,dadjokes
Eulogy of an egg,"He died last fry day. Thank God he wasn't beaten. Don't worry, he went over easy. He's now on the sunny side. He's definitely in a better plate.",dadjokes
What do you call a tardy sweet bean?,A chocolate!!!!!!,dadjokes
"My birthday is on July 24th, shame I was born in america. If I was born anywhere else....",it would be my birthday 24/7,dadjokes
"Obituary for the Pillsbury Dough Boy, Pop N Fresh","The Pillsbury Doughboy, remembered best as ""Pop N Serve"", and/or ""Pop N Fresh"", died yesterday of a severe yeast infection and trauma complications from repeated pokes in the belly.  He was 71.


Doughboy will be buried in this lightly greased coffin.


Dozens of celebrities will turn out to pay their respects, including Mrs. Butterworth, Hungry Jack, the California Raisins, Betty Crocker, the Hostess Twinkies, and Captain Crunch.


The grave site is expected to be piled high with flours.


Aunt Jemima will deliver the eulogy and lovingly describe Doughboy as ""a man who never knew how much he was kneaded"".


Doughboy rose quickly in show business, but his later life was filled with turnovers.. He was considered a very smart cookie, but wasted much of his dough on half-baked schemes.


Despite being a little flaky at times, he still was a crusty old man and was considered a positive roll model for millions.


Doughboy is survived by his wife, Play dough, three children: John Dough, Jane Dough and Dosey Dough, plus they had one in the oven.
He is also survived by his elderly father, Pop tart.


The funeral will be held at 3:50 for about 20 minutes.",dadjokes
Did you know I can run faster than lightning?,That's because lightning doesn't run,dadjokes
Why did the rooster lose the right?,Because he was way too cocky.,dadjokes
Why did the rooster lose the fight?,Because he was way too cocky.,dadjokes
"My son told me ""Dad, I accidentally rubbed ketchup in my eyes, and now it burns""","I said ""That's Heinz sight for you""",dadjokes
"A friend of my mine got sacked from his job, he asked Smoking or Non-Smoking",He should have asked Burial or Cremation,dadjokes
Scientists have grown vocal chords in a Petrie dish,The results speak for themselves,dadjokes
I painted my couch so you don't see it,Nobody has noticed sofa.,dadjokes
What do you call a flower with a mouth?,Tulips,dadjokes
How do you make a duck sing?,Put it in the oven till its Bill Withers,dadjokes
What's the difference between me and a calendar?,"A calendar has dates.....
Ba Dum Tissss",dadjokes
What did the frog say when he jumped in the puddle?,Knee deep,dadjokes
Which Pokémon is a door-to-door denture salesperson?,Pikachu,dadjokes
Did you know The Flash can run faster than lightning?,This is mainly because lightning can't run,dadjokes
What's a chicken's favourite anime?,Bok-Bok-Boku No Hero Eggadamia,dadjokes
What's brown and rhymes with Snoop?,Dr. Dre,dadjokes
What did the cheese say to himself in front of the mirror?,Halloumi,dadjokes
How do you know all woodpeckers love heavy metal music?,Because they’re all head bangers. (Credit to my 11 year old).,dadjokes
"As I sit here enjoying my breakfast, it makes me wonder what ever happened to my friend Wendy",I think the bacon ate ‘er,dadjokes
My dog has an obsession with ladders.,He keeps using them to get on the ruff.,dadjokes
"“Hey, how come I can see right through you?”","“My son came out as Transgender today, so that makes me *Transparent.*”",dadjokes
the man who invented the sexual innuendo just died,his wife is taking it hard,dadjokes
I called a psychic today.,"He picked up and asked,""Why did you call me?""
I replied,""You tell me""",dadjokes
Public Service Announcement: In order to meet the energy budget for 2020....,"the light at the end of the tunnel has been turned off. 

Thank you and have a nice day.",dadjokes
I just found out...,12” rulers won’t be made any longer.,dadjokes
Hate is such a powerful emotion to waste on someone who you don't even like.,,dadjokes
It's so great to see you!,'Cos now I know my eyes are working.,dadjokes
"I could say something about NRA and MAGA,","But it would probably just turn into an ANAGRAM joke,",dadjokes
What is it called when a priest is a popping a cyst?,An Exorcyst.,dadjokes
What do you call a fish that’s missing it’s i’s?,A blind fsh,dadjokes
To all the women out there who say size doesn’t matter:,You are all extremely shallow,dadjokes
If you boil a clown…,… is it considered laughing stock?,dadjokes
What was the first thing Sinatra said to his parents when he was born?,Let me be Frank,dadjokes
Someone stole my toilet.,"A detective came to the house, but he found nothing to go on.",dadjokes
Did you hear about this year’s Nobel prize nominees?,It included the inventor of “Silent Mode”.,dadjokes
What do you call someone who is kind of from turkey,Turk-ish,dadjokes
What do you call a rodent that fetches sticks?,A lab-rat!,dadjokes
i started taking lessons on rock climbing,Hopefully soon i get the hang of it.,dadjokes
The polar bear was acting weird at the zoo,i think it's bipolar,dadjokes
I was in the park wondering why frisbees got bigger as they got closer.,Then it hit me.,dadjokes
You can never trust your gut,It’s always full of sh!t,dadjokes
What’s a Wall Street farmer’s favorite thing to invest in?,Corn Stocks,dadjokes
Did you hear about the dsylexic atheist with insomnia?,He was up all night wondering whether or not there was a dog.,dadjokes
Did you hear about the dyslexic agnostic with insomnia?,He was up all night wondering whether or not there was a dog.,dadjokes
Do you know who can drink 20L of petrol?,Jerry can,dadjokes
why did the hunter shoot the map on the wall?,He saw a Turkey,dadjokes
Just heard some pretty sad news about yard sticks,Did you know they aren't making yard sticks any longer?,dadjokes
Oh no not again,So my friend came out to me as pan and my response was no you human 🤦,dadjokes
My friend said he could dodge a bullet,"R.I.P,  I wish i could say that i missed you my dear friend.",dadjokes
Why do cows have hooves?,Because they lactose.,dadjokes
What was the name of the prophet?,Seymour,dadjokes
What do you call leftover lettuce?,The romaines,dadjokes
What does a hangman and a hippie have in common?,They're both into tie-die!,dadjokes
A Scottish man was just forced to wear pants!,It damn nearly kilt him...,dadjokes
I like visiting my friend Maxwell's house.,we usually hangout and drink coffee,dadjokes
"We made a dill potato salad last night, and man, was it delicious. So fresh and herby...","It was some baller baller dill, y’all.",dadjokes
My ceiling is leaking but I have no idea how to fix it.,It’s way over my head.,dadjokes
If you took a picture of a Humpty dumpty book with a powershot zoom.,is a canon taking a shot of a cannon about a cannon.,dadjokes
"I imagine when Microsoft's co-founder Mr.Gates gets a suit tailored, they must fit him perfectly.",They have to fit the Bill.,dadjokes
Why did Rush Limbaugh take so much Oxycontin?,For the rush.,dadjokes
What do you call a spotted potato with lots of eyes?,A speck-tater.,dadjokes
I was drinking and dancing at this club for hours and hours when I dropped my watch,I lost track of time,dadjokes
What was Whitney Houston’s favorite coordination?,"


HAND - EYEEE!!!!!",dadjokes
"Trump and Pence were preparing to leave the Whitehouse for a big rally. When the helicopter arrived, Trump wasn't ready yet, so Pence asked: ""Do you want me to wait for you Mr. President?"" ...","""No Mike, you fly on ahead and I'll catch up later"".",dadjokes
[NSFW] What do you call a icicle that keeps giving you quizzes?,A Testacle,dadjokes
"While playing Mortal Kombat in Sweden, what does the announcer say at the end of a fight?",Finnish Him!,dadjokes
What do you get when you cross an octopus with a Mexican?,"I don’t know, but damn can it pick tomatoes!",dadjokes
What do you call a noodle that arrests people?,cop noodles,dadjokes
Why could the actor never read their lines from cue cards?,Because they kept trying to read between the lines,dadjokes
What do you call a bear that's missing its ear?,b.,dadjokes
What do you call a pianist that gets a heart attack on stage?,"Organ failure.

(Probably not NSFW, but marked it just in case.)",dadjokes
Why should you give someone ice cream when you want revenge?,Because revenge is a dish best served cold,dadjokes
Why did the golfer change his pants?,He got a hole in one!,dadjokes
Did you read about the new group that was created to foster dialogue between Wiccans and Jehovah’s Witnesses?,It’s called the Witch Tower Society.,dadjokes
Well...yeah,,dadjokes
What did the police officer tell his belly button?,YOU'RE UNDER A VEST!,dadjokes
What do you get when...,you mix a dad joke with a rhetorical question?,dadjokes
Researchers discover food that causes dizziness and itchiness,Stay away from spinach,dadjokes
I was going to tell a time-traveling joke......,....but you guys didn't like it.,dadjokes
How do we know the Joker likes soap operas?,Because some men just want to watch the world turn.,dadjokes
I bought shares in a music company.,It's a sound investment.,dadjokes
Two friends of mine are deciding on Halloween costumes,"They both want to be a Japanese soldier. So, I asked Sam...or...Ray?",dadjokes
Why is a vagina like deodorant?,"It's strong enough for a man, but pH balanced for a woman.",dadjokes
Ive painstakingly identified the 4 Horsemen Of The Apocolypse,"1. Toast Malone
2. Vladimir Gluten
3. Elon Crust
4. Bread Sheeran",dadjokes
"Character spacing is important, for example: ...","...writing: ""I have a music album"".  🎶

...versus: ""I have a musical bum"".  🎺",dadjokes
How do you make a tissue dance?,"

You put a little boogie in it",dadjokes
What do you call a hidden Legend of Zelda character?,A Missing Link,dadjokes
We cannot allow this year to end!,That would be admitting that 2021.,dadjokes
*Knock Knock* Me: Who's there?,"Knocker: You Know.

Me: You Know who?

Me: \*Opens door\*

Me: \*Drops dead\*",dadjokes
"Batman: “Alfred, please fill up the bathtub”",Alfred: “Sir? What’s a thub?”,dadjokes
Why can you never trust an atom?,Because they make up everything,dadjokes
This is Not Actually a Dad Joke,"But there is nothing more gratifying than when I tell a great Dad joke and my wife goes “Damnit, I fell for it.  I thought you were being serious.”

And for those of you disappointed in the lack of a joke, two guys walk into a bar and it hurt.",dadjokes
Who is Anakin Skywalker's main in Smash Bros?,"Ganondorf, because they both enjoy ""killing young links"".",dadjokes
Why was the gay man exhausted after a long day at the office?,Because he worked 9 hours straight.,dadjokes
My friend thinks drinking beer makes him more intelligent.,I don’t think that makes my Budweiser.,dadjokes
How do you spell racecar backwards?,R-a-c-e-c-a-r b-a-c-k-w-a-r-d-s.,dadjokes
What do you call Ice Cube’s mom?,The Ice maker.,dadjokes
What do you call Bob the Builder when he is unemployed?, Bob,dadjokes
A dog stole a skeletons left arm and left leg.,"It’s ok, he’s all right now.",dadjokes
Why are lions rarely cannibals?,Because dont like to swallow their pride,dadjokes
"I wanted to erect using P, E, N, I, S; so I made...","SPINE.

*(But I love how your mind works)*",dadjokes
Lance isn’t a very common name today,"But in medieval times, people were named Lance a lot.",dadjokes
"Did you hear about the spies trying to infiltrate japan, Italy, and Germany in WWII?",They were denied axis.,dadjokes
Help wanted: telepath.,You know where to apply.,dadjokes
What did the trumpet pharaoh do when his girlfriend told him to pull out?,Toot and come in,dadjokes
My chiropractor is a funny guy,He cracks me up,dadjokes
Someone spilled mayo all over me,I was like what the Hellmann!?!,dadjokes
What do you call a faucet in the capital of Belgium?,A Brussels spout,dadjokes
What's a KKK wizard's favorite drink?,White Powerade!,dadjokes
I never forget colorful boobs,They're vivid mammaries,dadjokes
What do baby mathematicians drink?,Formula,dadjokes
What do you call it when a lorry of tortoises crashes into an aquarium?,A turtle disaster,dadjokes
What fruit decided to elope?,Cantaloupe,dadjokes
"A little girl turns to her mother and asks, ""What is that rasta man cooking behind us?""","The mother turns around to look and says, ""I don't know sweetie. What Jamaican?""",dadjokes
Have you heard of the pregnant bed bug??,She’s going to have her baby in the spring!,dadjokes
My dad claims to have invented a shelter for camping.,"I politely told him, patent.",dadjokes
Get your fact straight!,"Son: Trump is a liar!
Dad: You see that on CNN?
Son: No. I Reddit.",dadjokes
How do you know you're ready to become a dad?,When you're full groan.,dadjokes
"Her: ""Nice job, these are good scones""","Me: ""That's what I was scone for!""

Her: ""Ugh.""",dadjokes
What do you call a cold canine?,A chili dog.,dadjokes
"The Indianapolis Colts lost again today, and now everyone is mad at Google Maps...",...because any idiot could have told them to take Teddy Bridgewater over Philip Rivers.,dadjokes
What do you call a sketch of vinaigrette?,vignette,dadjokes
Why don’t melons get married?,Because they cantaloupe.,dadjokes
We just made pizza on Indian flat bread,I have to say It was naan’t bad!,dadjokes
"My 3yo is in a phase where he makes up words a lot, and today I heard him singing ""Crotch-ohs, crotch-ohs"" over and over. I told my wife, ""That sounds like the worst breakfast cereal ever...""","""But at least it's made with whole groins.""",dadjokes
What was Whitney Houston’s favorite type of coordination?,"

HAND-EYEEEEEE!",dadjokes
Before the crowbar was invented,Most crows drank at home,dadjokes
What did the bartender say to his date?,Alcohol you later,dadjokes
How much do dumplings weigh?,Wonton,dadjokes
If you're ever in India you have to check out my favorite restaurant,The Deli Lama,dadjokes
How do you fix a broken jack-o-lantern?,A pumpkin patch,dadjokes
I bumped into a crocodile yesterday...,"He said: ""Sorry!"" And then I said ""Parolas Esperanton!""",dadjokes
Why was the beach wet?,The sea weed,dadjokes
I think this belongs to this sub,,dadjokes
What do you call a Bee’s ghost?,Boo-Bees,dadjokes
Which African country is TESLA founder Elon Musk from?,"Mad-at-gas-car, obviously.

(It just came to me and I had to share it.  I'm so sorry)",dadjokes
My daughter asked how old she will be next month.,"My daughter woke me around 11:50pm last night. My wife and I picked her up from her friend Sally’s birthday party, brought her home and put her to bed. My wife went to the bedroom to read and I fell asleep watching basketball.

“Daddy”, she whispered tugging my shirt.

“Guess how old I’ll be next month?”

“I don’t know, honey.” I said as I slipped on my glasses. “How old?”

She smiled and held up 4 fingers. 

It’s now 7:30am. My wife and I have been up with her for almost 8 hours. She still refuses to tell us where she got them.",dadjokes
You and your wife are playing hockey and she shoots,She Mrs. the net!,dadjokes
What does a Rastafarian use to keep his beer cool in the hot tub?,A jah-koozie,dadjokes
I forgot that I hated Nickelback until you blasted their song on the radio...,And this is how you remind me?!!!,dadjokes
What do call a melon that has to get married in a church?,Cant-elope,dadjokes
"A little moron and a big moron were shingling a steep roof when suddenly the scaffolding collapsed. They both slid down the roof and stopped at the very edge, and then one fell off. Which one?",The big moron. The other one was a little more on.,dadjokes
I'm still figuring out how to properly wear a face covering. Before I could master the art I was robbed of my beloved mask...,It was stolen from right under my nose.,dadjokes
Why did the hummus blush?,Because it saw a chickpea!,dadjokes
I hear breast implants are back in a big way in the Bay Area,They’re calling it Silicone Valley.,dadjokes
"Statistically,",6 out of 7 dwarves are not happy.,dadjokes
"""I'm afraid of that crazy man nuking my country!""",I said in North Korean.,dadjokes
What do you call a bear without ears?,b,dadjokes
I think my I Phone X has a face fetish,"Just by looking at my phone, it turns it on!",dadjokes
What did the hardware store employee use to steal personal information?,A Hacksaw.,dadjokes
