title,selftext,subreddit
You can never run through a camp site!,You can only ran...cause it's past tents,dadjokes
I invested in a fertility clinic....,Heard the business was expanding,dadjokes
Did you know ancient Egyptian houses didn’t have a door knocker?,Instead they had a horn and a sign saying “Toot and come in”,dadjokes
I just planted a new tree in my back yard. It’s really beginning to try new things.,You might say it’s starting to branch out.,dadjokes
What’s J-Lo’s favorite race?,"Iditarod 

(I did A-Rod)",dadjokes
Why is childbirth called delivery?,Shouldn't it be called take out?,dadjokes
The difference between your opinion and coffee is....,I asked for coffee.,dadjokes
I saw a documentary on frogs recently.,It was absolutely ribbiting.,dadjokes
My Wife was doing Yoga and I asked her if she was ready to go.,She said Namaste,dadjokes
I broke up with my royal girlfriend...,She was too entitled.,dadjokes
What do you call a duck that can rap?,Drake,dadjokes
Don't blame others for the road you're on,It's your own asphalt,dadjokes
What’s the interior temperature of a Tauntaun?,Luke warm.,dadjokes
Rape bad,r/ape good,dadjokes
"I've had M.C. Hammer music in my head so much today that's it's giving me a headache. I took 2 Tylenol, but....",It can't touch this.,dadjokes
A man took a bullet to the face in a shooting last week. If anyone has any information please call city police.,The only thing they have to go on is the mug shot.,dadjokes
The hardest thing about wrapping paper is...,Nothing rhymes with “paper”.,dadjokes
My daughter recently had surgery and they couldn’t get the IV in but...,They just kept trying in vein!,dadjokes
Dairy farms,"A man raided multiple dairy farms and started beating the cows with porcelain dolls.

It was the first ever Nik nak patty whack ever",dadjokes
What do you call an alligator that shows up suddenly and out of nowhere?,An Instagator!,dadjokes
What country is home to the world’s most expensive rollercoaster?,Coaster Rica,dadjokes
how does a non-binary kill people?,They/Them,dadjokes
They renamed the charger for the iphone.,Now they just call it apple juice.,dadjokes
Reason to date a cardiologist,,dadjokes
Asked my contractor why he didn’t bill me for my new roof,"He said “Don’t worry about it, it’s on the house!”",dadjokes
Were they really fighting?,Or were they just Joshing around?,dadjokes
Why does Missouri like being surrounded by other states?,Because Missouri loves company!,dadjokes
I used to hold the record for the best DJ...,...but then he decided to just carry it himself and I got laid off.,dadjokes
I don’t really like my new haircut,But it’s growing on me,dadjokes
I just became a pilot!,I guess you can call me your wingman.,dadjokes
Someone threw a jar of mayo at me,I yelled what the Hellmann?!,dadjokes
I’ve decided to open a museum dedicated to bracelets that happen to be magnetic.,Hopefully it will be a big two-wrist attraction.,dadjokes
"A group of physicists came to my restaurant today, ate then explained what the force required to accelerate a mass of one gram at a rate of one centimeter per second squared is. Then when my attention was elsewhere, they all left, leaving behind a bunch of hyphens...",I should have known they'd dyne and dash.,dadjokes
What did the teeny tiny blanket have over the large quilt?,It was Microsoft.,dadjokes
Which setting does Captain America search for in his Android Settings?,,dadjokes
People began paying the Hawaiian volcano goddess to lie down from time to time,They're calling it a pay lay,dadjokes
so I was washing my cat and then it dawned on me,I don't even have a cat,dadjokes
"Since the pandemic, my friend has been doing well selling vases made from herbs mixed with ancient crushed Chinese plates...",That's pretty good thyme-Ming.,dadjokes
Grocery Store,"I took my son to the store to get some ingredients for dinner. We were having Mexican food, and when we got to the aisle with the salsa, my son stared indecisively at the shelves. After a good minute, he still hadn’t made a decision and I knew my wife would be wondering what was taking so long.

So I told him,

“Son, pick up the pace.”",dadjokes
How do you determine the mass of a red hot chili pepper?,"Give it a weigh, give it a weigh, give it a weigh now",dadjokes
I used to have a job crushing pop cans,But it was soda pressing,dadjokes
What do you call a last who refuses to pay her bills?,Bernadette.,dadjokes
What kind of pants do storm clouds have,Thunderwear,dadjokes
What do you call a lady who refuses to pay her bills?,Bernadette.,dadjokes
What kind of pants does a ninja wear?,"KIHAAKIIKS 

 -Courtesty of my girlfriend I've never been more proud",dadjokes
What does a tick and the Eiffel Tower have in common?,They are both Paris sites.,dadjokes
Don't put Coins inside the Washing Machine!,It's Money Laundering.,dadjokes
Why is it that nobody who lives within ten miles of Wisconsin's Forest Home Cemetery is allowed to be buried there?,Because they're all still alive!!,dadjokes
What do you call a prostitute eating meat?,A carniwhore,dadjokes
Did you hear about the magic tractor?,It drove 2 miles down the road and turned into a field.,dadjokes
What do you call a carrier pigeon that has become afraid to fly?,A warier pigeon.,dadjokes
Cheesy joke,"So my wife and stepson sit down to dinner and we are having a dish made with sausage and Halloumi. 

Me: did you guys know that this cheese  glows in the dark

Stepson: What?
Wife: Really?

Me: Yes, it’s known for it...go on, turn off the lights

Wife (looking suspicious but intrigued) gets up and goes to light switch, ready to plunge us into darkness: It actually glows in the dark?

Me: Yes, it’s Hallouminous 

Cue groans and stifled laughter....

Ten minutes later....

Me: All the famous inventors and artists loved this cheese best.....Michelangelo, Picasso, Da Vinci....

Pause....

Me: Anyone part of the Hallouminati really

Stepson: gaffaw The Hallouminati. 

I felt I earned my Dad (even if stepdad) joke stripes that evening.",dadjokes
Why can't an otter breathe in his house?,Because there is no air in otter space.,dadjokes
"Dad, what does Lab Grown Meat taste like?","Kinda like Labrador Puppy Meat. 

Grandpa calls it: Inner-City Veal, but he was in Vietnam.",dadjokes
They asked me how I put the wood together so well.,"I said, I nailed it.",dadjokes
What's the difference between rockets and an empty plate at an English cream tea?,One has nose cones and the other has no scones.,dadjokes
What is a Māori' favourite car?,Kia Ora Ford.,dadjokes
Why is doggy style the position of choice amongst married couples?,Because women turn into right bitches when they get married.,dadjokes
"I heard a report about a bad outbreak of the tummy bug, apparently 9 out of 10 people there suffered from diarrhea.",I can’t stop thinking about that tenth person who apparently enjoyed it.,dadjokes
"""I really don't know which kid I'm supposedly being unfair to, according to my wife,","Thomas, Anton, or the fat, ugly one?""",dadjokes
Why did the lion cross the road?,To get to the other pride,dadjokes
What do you call when you cheat on your wife in LA?,Californication,dadjokes
My sister bet me that I couldn’t make a car out of spaghetti,You should have seen her face as I drove Pasta,dadjokes
What's a knife smith's favorite beverage?,Tang,dadjokes
"I asked my wife, “How do you find the quickest way to go from place A to place B?”","Her: Google Maps.

Me: I don’t have much time. Can you narrow it down?",dadjokes
What do you call a blood-spattered book?,A graphic novel,dadjokes
What’s a penguin’s least favorite vacation destination?,Wales.,dadjokes
"Thousand and thousands of years ago, during the last ice age, there lived an animal that excelled at trigonometry, geometry, and could recite Pi to 100 decimal places. It was known simply as.....",.....the mammothematician.,dadjokes
What do u call Yuri Gagrin playing basketball?,SPACE JAM,dadjokes
What does an elephant and a giraffe have in common?,"They both start with a “G”. 

Elephant’s name is George.",dadjokes
on r/teenagers but belongs here,,dadjokes
What was the man who installs granite tops in Kitchens charge with?,Counterfeiting,dadjokes
A man walks into a bar,"""Ow"" he said.",dadjokes
What did Nazi airmen eat for breakfast?,Luftwaffles,dadjokes
I wanted to write a poem about snow,But I couldn't make it Rime,dadjokes
Tesla just announced they’ll be including a bottle of their new cologne now with every car sold,It’s called Elon’s Musk,dadjokes
A new sexually transmitted infection has been found in the African contient,[deleted],dadjokes
What do you call a Mexican boyband?,Juan Direction,dadjokes
I just released my own fragrance.,Nobody in the car seemed to like it.,dadjokes
What do you call an Avenger in extreme cold?,Falcon and the Winter Jacket.,dadjokes
Where do sea cows sleep at night?,In barn-acles.,dadjokes
Warning: Do not buy tickets for the Eskimo lottery - they will sell you the ticket but they only pay out to native Eskimos.,You've got to be Inuit to win it,dadjokes
Dwayne “the rock” Johnson,And then it hit me like a ton of bricks that NOBODY calls there 🍆 this 😂 and it’s perfect because his nickname is “The Rock” and his last name is Johnson and I had to come find the best dad joke group out there to come and post it to.,dadjokes
My girlfriend is blamimg me for ruining her birthday...,I didn't even know it was her birthday!,dadjokes
What's the definition of a mistress?,Something in between a mister and a mattress.,dadjokes
A fraudster who installs kitchen worktops for a living got arrested,Police say he was charged with counter fitting,dadjokes
What is the difference between a hippo and a zippo?,One is heavy one is a little lighter.,dadjokes
Why did the scarecrow get the job promotion?,He was outstanding in his field.,dadjokes
What's the difference between my dad and cancer?,My dad didnt beat cancer,dadjokes
A man can fly,"So there was a man and woman at a bar. The man says ""I bet you 5 bucks this magic water will make me fly!"" the woman clearly didn't believe him so she accepted the bet. Sure enough the man jumps off the roof and flies for a bit until he gently goes back to the ground. The girl was amazed! She said ""You should market this stuff."" ""You could make millions!"" Still in shock she asks for a drink. She takes a swig and a small crowd forms because this girl is about to jump off of a building. She jumps off and falls onto the pavement. The guy is laughing his head off. Suddenly someone shouts from the crowd ""You're a mean drunk superman!""",dadjokes
What is Jesus' favourite band?,Nine inch nails.,dadjokes
There were 2 ancient soldiers on a boat escaping Greece.,"One yelled ""ROW MAN!""",dadjokes
What would a basketball game set in heaven be named?,Sky rim,dadjokes
I went on tinder and I found this girl who said she needed a bone narrow doner,"And it turns out, we were a perfect match",dadjokes
I lost my Tic Tacs today.,Now I'm looking for replacemints.,dadjokes
"H: ""Knock knock!""","Son: ""Who's there?""

H: ""H""

Son: ""H who?""

H: ""Bless you""",dadjokes
"Mouse1, ""You see that piece of cheese on the trap?""","Mouse2, ""Yeah""

Mouse1,""Its to die for.""",dadjokes
Big shout out to my fingers...,I can always count on them!,dadjokes
What does Jeff Bezos do before bed?,He puts his pajamazon.,dadjokes
I’ve decided to name my son Mark.,"That way, when I die, I’ll be able to say I left a mark on this world.",dadjokes
What do you call a weapon that doesn't kill animals?,A vegun,dadjokes
My toddler keeps sticking that baby booger sucker in her nose...,"She's got great aspirations. 

[*No, really...*](https://imgur.com/a/WPG93CZ)",dadjokes
Have you heard of the new psychological therapy for trendy kids?,Hipnosis.,dadjokes
Early breakfast,"I passed a cafe serving Early Bird breakfast
...   do those birds lay fresher eggs?",dadjokes
"My buddy was showing me around his tool shed when he pointed at something and said, ""That's my stepladder.""","""I never got to know my real ladder.""",dadjokes
"My dad said, “I think you have an iron deficiency.”","I said, “How do you know? You are not a doctor.”

He said, “Your shirt is wrinkled.”",dadjokes
Why is Dark spelled with a ‘K’ and not a ‘C’?,Because you can’t ‘C’ in the dark,dadjokes
Why are dogs and seniors similar?,They both bark at anything thats on their lawn.,dadjokes
One guy walks into a bar,"The other one says ""Thats going to leave a mark""",dadjokes
My son asked if he could have a book mark,I broke down crying. Its been 15 years and he still doesn't know my name is jack!,dadjokes
If you got infected with itchy bugs when you went out to play,Would you call them playbies?,dadjokes
What did the penguin's lawyer say?,"""Your honor, my client is CLEARLY not a flight risk.""",dadjokes
"Disclaimer: this is my 5 year old son's joke. He is a dad in the making. ""Everest is the biggest mountain. Mount Fuji is the prettiest. Which mountain is the stinkiest?""",K-Poo.,dadjokes
Did you hear about the students complaining of aches and fatigue when they did math homework?,They're calling it fibromyalgebra.,dadjokes
What do you call a cross between a Bulldog and a Shih Tzu?,Bullshit.,dadjokes
Looking to sell my DeLorean...,...I’ve only driven it from time to time.,dadjokes
What do you call someone who won't get off your lawn?, A grasshole.,dadjokes
"What do Germans call the first day of wheat harvest, and also a popular children's game where kids chase each other around a wheat field?",Gluten Tag,dadjokes
I believe that orchestral music is inappropriate for kids.,There’s too much sax and violins.,dadjokes
From my 7yo: What do you call a diamond in the rough?,A diamond.,dadjokes
What's Michael J Fox's favorite movie?,Tremors.,dadjokes
I got arrested for stepping on a cheerio,Guess the authorities thought I was a cereal killer,dadjokes
The strangest job I had was cleaning the monkey cages at our local zoo.,That shit was bananas.,dadjokes
Did you hear about Orion's belt?,"It was such a big waist of space.

Sorry.. I know terrible joke. You can leave a 3 star review.",dadjokes
I had to stop a candy thief today.,He was getting back to his old Twix.,dadjokes
Why can't Santa have any kids?,"Because he has popcorn balls.


-I make a point to tell my wife this one every year around Christmas. Eye roll means she liked it, right?",dadjokes
You heard about those 2 beans that went around Australia?,Yeah nah yeah they ended up baked in Cairns,dadjokes
Where does frosty the snowman keep his money?,Nowhere! He has Snow pockets!,dadjokes
Why is doctor spelled with a C and not a K?,because who needs a doctor when it's ok?,dadjokes
My son told me to move aside.,"So I said ""Sorry, I only have a B side.""",dadjokes
I just bought thousands of shares in a cattle ranch.,Which makes me a major steak holder.,dadjokes
When I ask you a question don't answer with another question ?,,dadjokes
"If you're born on Earth Day,","then it's your B-Earth-Day


(Note: Yes, I'm born on Earth Day and hence am posting this.)",dadjokes
"Man, I've had it with Amazon.","Every time I order chicken pellets and grain, they email me 3 days later, asking for their feed back.",dadjokes
What do you call a squished bee that doesn't die?,A zom-bee.,dadjokes
What do you call a chiropractor’s kid?,Well adjusted,dadjokes
Why should Australians be banned from international chess tournaments?,"Cos they keep saying ""check, mate""",dadjokes
It's been 45 years....,And my kidneys still aren't adultneys.,dadjokes
What did the cloud get for finishing in fourth place?,A precipitation award.,dadjokes
Why did the disappointed chicken cross the road,To get to the other sigh,dadjokes
Got banned off of r/wholesome memes,for posting Swiss cheese jokes,dadjokes
What weighs more 10 pounds of bricks or 10 pounds of feathers?,Feathers because you have to carry the weight of what you did to those poor birds,dadjokes
I went to a truck dealership,Dunno if i should tell my wife about the pickup line,dadjokes
"My two year old was playing cars and blocks with my wife, when she (the toddler) put a block on the road on her city map carpet and said:","""Road Block""",dadjokes
We were all following an old pipe,It lead,dadjokes
What do you call a know-it-all asian kid?,Exact Lee,dadjokes
What's a math teachers favourite food?,Cos -law,dadjokes
Never put a King Bed next to a Sofa.,It’s Sofa King Bed!!!,dadjokes
"Me: ""Excuse me, can you show me where the self help books are?""","Librarian: ""Well, that would kinda defeat the purpose, don't you think?""",dadjokes
What is the difference between a teepee and George Michael’s toupee?,"One’s a wigwam, one’s a Wham! wig.",dadjokes
What do you call a sad flower?,A not-so dandelion,dadjokes
"I told my 7 year old daughter, ""Go to bed, the cows are sleeping in the field.""","Puzzled she asked, ""What's that got to do with anything?

I chuckled, ""Well that means....its pasture bedtime. """,dadjokes
"I had to have my pet centipede put to sleep this week, after he lost 84 of his limbs.","The vet said, he was on his last legs.",dadjokes
You know you are getting old....,When the candle costs more than the cake.,dadjokes
"Next time I'm on a roller coaster, I'm bringing some nuts and bolts with me.","When nearly on the top, scream with a panic voice at the guy infront, ""LOOK BRO, THESE FELL OUT OF YOUR SEAT.""",dadjokes
A girl with three cats told me that she is going to get another cat,I was confused why she wanted a hat made of forks,dadjokes
A girl with three cats told me that she wanted to get another cat,I was confused why she wanted a hat made of forks,dadjokes
Why owls are so smart?,knOWLedge,dadjokes
Do you know what makes Edam cheese so special?,It’s the only cheese that is made backwards,dadjokes
Why does Jesus rise?,Because his body was made out of bread,dadjokes
Who is iron man’s great enemy,"

Anemic man",dadjokes
What did the 0 say to the 8?,Nice belt.,dadjokes
The other day a bunch of books fell down on my head.,I guess I only have my shelve to blame!,dadjokes
The Grape General,"There was once a general that was a Grape. He always made people wine and, was always on time for Fruity Duty.",dadjokes
What do you get when you send a bad audio file?,A bit of FLAC,dadjokes
I would make a spice cake...,... but I don’t have thyme for it!,dadjokes
"Initially, I despised sheltering in place, but now I love it!",I think it’s Stuck-home Syndrome,dadjokes
A girl named Autumn tried to prank me.,I didn’t fall for it!,dadjokes
I saw the ghost of Gloria Gaynor last night,"First I was afraid, I was petrified",dadjokes
I thought about auditioning for that play called The Spices.,I want to get the Cinnamon role.,dadjokes
An oboist married an electrician.,She found out that his interpretation of A 440 Hz!,dadjokes
What’s an impostor’s favorite breakfast?,Sus-age.,dadjokes
What did Delaware?,A New Jersey.,dadjokes
I wrote a poem about overthrowing governments.,It was a Haiku D’etat.,dadjokes
How does a dart board on the ceiling make you sick?,Causes you to throw up,dadjokes
Ole and Lena were driving home from town when Ole hit a momma skunk and managed to miss her 3 babies.,"Lena could not leave them on the side of the road so they scooped the babies up and put them in the car. As they drove the baby skunks managed to make their way from the floor up Lena's dress and settled on her lap.  Lena looked at Ole and said ""the skunks are under my dress"". Ole said ""Zat's OK dear zey are settled down"". Lena said ""Vhat about the smell?"". Ole said, ""Oh, don't worry dear they will get used to it!""",dadjokes
The best dad joke of all,My second son was born today at 1:05!,dadjokes
"Ever hear of Henry, Santa's brown nosed reindeer?", He is just as fast as Rodolph but couldn't stop as quickly.,dadjokes
My wife came home with a bunch of spring flowers and asked where I'd like her to put them.,"I said, "" I'll tell you where you can plant your tulips.""",dadjokes
"What’s the perfect name for a baby boy who’s half white, half Indian?",Rajer,dadjokes
How does a non binary kill people?,They/Them,dadjokes
My chickens escaped and over my yard...,I wasn't expecting the coop d'etat.,dadjokes
What was the child who wouldn’t nap guilty of?,Resisting a rest!,dadjokes
There were 30 cows and 28 chicken. How many didn't?,10.,dadjokes
why was the cow pissed with the tractor in a race ?,cause it was mooving faster than it,dadjokes
my wife and dog both love licking my face...,guess i’m just a piece of meat for them,dadjokes
My wife and I got into a heated argument where she told me I had to stop pretending to be a flamingo,So I had to put my foot down,dadjokes
Thought about posting a dad joke to Reddit.,But you have probably already read it.,dadjokes
"Ms Wilson, Australian star of the Pitch Perfect movies has announced she no longer believes in Santa.",She is a Rebel without a Claus.,dadjokes
"Last night my house was broken into, and all they stole was soap.",Dirty criminals. Cops say they got away clean,dadjokes
What’s the worst part of having an apple addiction?,You can’t see the doctor about it.,dadjokes
People say I’m like a broken record,People say I’m like a broken record,dadjokes
The other day I ascended,"day 74 no fap

As I exited my vehicle to walk into work I caught scent of a female in heat 73.35 meters upwind. Because of the fog I couldn’t see her yet but judging by the scent she was mid twenties, and healthy. My ultra attunated hearing was able to pick up her gait, which put her at about 5’6”. My mind, free of the constraints of porn and indecent imagery, was able to calculate her weight based on the ripple in the testosterone continuum produced by her footsteps as she walked away from me.

Being that I was 10 minutes early for work, I made chase and followed her through the fog still without visual contact. I was like a pilot navigating the white abyss by instrument alone. I was trailing her about 130m behind when I sensed her phone vibrate in her purse through the pavement. Holding my ear to the ground I was able to faintly pick up on the conversation she was having with beta BF. Based on the annoyed tone in her voice I knew now was the time to strike.

I readied my legs and concentrated all of my Testo-chakras into my Vastus Medialus muscles as I assumed a sprinters starting stance. I exploded forward in a cataclysm of sex hormone fueled rage. Exactly 2.54 nanoseconds later I began to phase through time and space as I meshed with the testosterone continuum. As I phased through the helpless female target I nutted directly into both of her Fallopian tubes, destroying her previously unbroken hymen and causing her to orgasm INSTANTLY. As I began to slow down 33.6 light years later, I realized that while she would have wanted to thank me for giving her the gift of my superior seed that she was already dead and gone having raised my CHAD progeny to repopulate the earth.

As I float into the the celestial abyss of the greater Crab Nebula I am not filled with regret for having left my world, but rather happiness for having left it a better place.",dadjokes
"The alarm clock may be bulky, dirty, and poorly designed",But it's what's on the inside that counts.,dadjokes
Why did the cowboy start making lassos?,He got roped into it.,dadjokes
How do you know a successful female serial killer?,She has a run in her stalkings.,dadjokes
"I have a buddy who is a prominent geologist, but outside of work, he's very lazy and inactive.",He lives a sedimentary lifestyle,dadjokes
"My friend, who is the downstairs neighbors to Dwayne Johnson, doesn't know about the new Godzilla movie",Apparently he'd been living under the rock the whole time.,dadjokes
Dad: how was your exam son?,"Son: it was good .. 
Dad: so you’re gonna pass then?  
Son:.. nah .. not that good ...",dadjokes
"The 9 year old comes running in from the garage where he was helping grandpa. ‘Daddy! Papops said shit 2 tines!’ ‘Well how about that son,’",‘You and me only said shit once’,dadjokes
Will glass coffins ever be popular?,Remains to be seen.,dadjokes
Today I found out my son is gay,"Me: Who are you dating son?
Him: A man, duh!",dadjokes
"I just realized why the game is called ""cricket""",it's about the spectators' reaction...,dadjokes
What do you call it when you feel extremely sad in Southeast Asia?,Tropical Depression,dadjokes
What do you call a ton of backlog work ?,Mountain Due,dadjokes
What’s the difference between a father and a mother?,The M.O.,dadjokes
How do you call Quentin Tarantino in 2021?,Quarantino.,dadjokes
Dad: *Watching cop show with daughter late at night* Dad: Time for bed kiddo! Daughter: I’m not tired yet though!,"Dad: *Pretending to be a dispatcher* Yeah, she’s resisting arrest",dadjokes
Circus freaks are skilled at any game they play,It's hard to win when the odds are stacked against you,dadjokes
How does a locksmith fix a lock?,Key-P-R,dadjokes
How did the arborist save a tree?,Tree-P-R,dadjokes
[Political] Donald Trump was the united states longest sitting president,"now now, I know what you are thinking;

""but Obama spent 8 years in the white house!""

yes, that is true

but how much of that was he busy instead of sitting?",dadjokes
What's the best thing about Switzerland,Idk but their flag is a huge plus,dadjokes
Whats your favorite month?,"Dad: July

Me: Why July?

Dad: I didn't lie",dadjokes
What did O say to Q?,Wear some underwear and stop flashing you pervert!,dadjokes
"""Dad, how come you never make dad jokes?""","""Son, I made *you""*",dadjokes
I told my wife I was going to build a car out of spaghetti,Should have seen the look on her face when I drove pasta.,dadjokes
