title,selftext,subreddit
The wife looked concerned when my son showed an interest in electricals at the age of 5.,"He asked about the neutral wire.

I said ""don't worry, its just a phase.""",dadjokes
"Which conifer do all other trees call ""The Boss""?",Spruce Springsteen.,dadjokes
A midget who was a fortune teller robbed a bank,The call went out that a small medium was at large,dadjokes
What’s the scariest plant?,Bamboo.,dadjokes
What do you call a movie about a wanted whale.,Freeze Willy,dadjokes
"I saw a man riding a bike up a hill, yet he walked.",Yeti was the name of his dog!,dadjokes
What do you call J.K. Rowling at a rave?,J.K. Rolling,dadjokes
Time flies like an arrow,Fruit flies like a banana,dadjokes
What do you call a bulletproof church?,Unholy,dadjokes
I bought my friend a cat for their room., They said thank you I like cats. I said you're welcome me too. Cat said mewtwo.,dadjokes
What did the triangle say to the circle?,You’re pointless,dadjokes
I was getting close to retiring and offered my compost business to my son.,"He replied, “I refuse to work with compost! Is so degrading!”",dadjokes
Did you hear about the guy whose left side got chopped off??,He’s all right now,dadjokes
What's the definition of Baroque?,When you run out of Monet,dadjokes
Why does the Vatican smell so good?,The potpourri!,dadjokes
What do you call a group of depressed kids,The Suicide Squad,dadjokes
I lied to my boss about getting Covid and he found out,Tried to explain it was only a sick joke,dadjokes
What is the best armor for stealth?,Leather. It's made of hide.,dadjokes
How do figure skaters prepare for competitions,Pract-ice,dadjokes
I just shaved my beard off but left behind a big ol dirty moustache,It’s growing on me,dadjokes
What happened when Santa didn't pay to park his sleigh?,It got mistletowed.,dadjokes
I know a good joke about Ikea furniture,But I'm still putting it together,dadjokes
How can you tell snowmen from snowwomen?,Check for snowballs.,dadjokes
Me: Someone told me that there’s a fruit that’s an excellent source of potassium.,"Her: That’s bananas.

Me: Yeah, I was shocked too.",dadjokes
Apparently Florida has the highest rate of infidelity in the country...,A truly unfortunate state of affairs.,dadjokes
I took a picture of my son sleeping earlier today.,Then I sent the picture to the FBI as evidence of a kid napping.,dadjokes
What’s a cat’s favorite color?,Purrrrrrrrrrrrple,dadjokes
Did you hear about the human cannon-ball?,He was fired recently.,dadjokes
"If the day before Christmas is known as Christmas eve, then what's the day after known as?",Christmas Adam,dadjokes
What’s the difference between a Harley and a Hoover?,The position of the dirtbag,dadjokes
My dad tried to sing yesterday.,He had a bit of treble with the high notes.,dadjokes
What car starts with P?,None they all start with gasoline,dadjokes
Why do vultures never check their bags on an airline?,They prefer carrion,dadjokes
Three legged dog hobbles into a saloon. Looks around and says...,"“Alright, who shot my paw!”",dadjokes
I met a girl with 12 breasts,"Sounds strange, Dozen tit?",dadjokes
What do lawyers wear to work?,Law suits,dadjokes
I'll always refer to my stomach as Budapest,Because it is the capital of Hungary.,dadjokes
I post a lot of dad jokes,That's how eye roll,dadjokes
How much does Santa pay to park his sleigh?,"Nothing, it's on the house.",dadjokes
What sound does a bouncing plane make ?,Boing boing boing,dadjokes
"My dad isn’t usually one full of dad jokes, but he hit me with a great one today.","For context, my dad had a leg amputation a few months back but he’s been in mostly good spirits about it. We were talking about places to eat in our area, and he asked where one of the fast food restaurants was around here, so I said “It’s at the intersection, where the IHOP is.”

Dad replied, “Oh, that’s my favorite place to get breakfast.”

I never got food with my dad at IHOP before so I was confused, but then it dawned on me what he meant. 😐",dadjokes
My grandpa declined seeing the Head Cardiologist.,"He said that his heart is in his chest, not his head.",dadjokes
My friend Robert is a lawyer who specializes in helping convicted people by getting their records erased permanently. Everyone calls him...,Expunge Bob,dadjokes
How do you get out of an elephant?,You run around until you're all pooped out!,dadjokes
A guy sees a pirate walking down the street with a steering wheel in his pants...,"He yells, hey! Hey, pirate! There's a steering wheel in your pants! Pirate says, Aarr, I know! It's driving me nuts!",dadjokes
I just had a near sex experience.,My wife flashed before my eyes.,dadjokes
Why does Snoop Dog carry an umbrella?,Fo Drizzle  ☔️,dadjokes
My mom said this unknowingly but it still counts,"So I was complaining about where I am in life and the path I have chosen she said

""Don't try to blame someone else for the road your on ....its your own asphalt""",dadjokes
What happened when the girl didn’t pay her exorcist,Her soul got repossessed,dadjokes
Where does Santa keep his money?,In the snow bank.,dadjokes
I wanted to share my joke about the wind....,.....but it's only a draft.,dadjokes
What's the opposite of Aretha Franklin?,Urethra Frankiln,dadjokes
Today I bought extra virgin olive oil,After I used it it was just olive oil.,dadjokes
What did the Superhero say when he got all his teeth knocked out?,He said he was Thor.,dadjokes
A pun walked into a bar and ten people died on the spot.,"Pun in, ten dead.",dadjokes
My daughter asked me for a horse...,I told her that to properly care for a horse... one must first have a stable income.,dadjokes
"Apparently, Santa has epilepsy....",He seizures when you’re sleeping.,dadjokes
"I heard some people were mad at Trump for not doing his job. I wasn’t surprised, though.",We do live in unpresidented times.,dadjokes
I cut down a Christmas tree today. My wife asked me if I was going to put it up myself.,"
I said: “Of course not. I was going to put it up in the living room.”",dadjokes
What happens when you get some salt on your mouth?,you have a salty mouth.,dadjokes
How do whales give birth?,A Sea-section. 🙃,dadjokes
What did Santa say after his Christmas dinner dump?,"""Well, will you look at the size of THAT yule log!""",dadjokes
What do you get when you grind orphan wheat?,Self-raising flour.,dadjokes
Serious post about a joke!,"If you watch Bob's Burgers, the joke sign in the intro for this year's Christmas episode VERY closely resembles one I thought of YEARS ago. I won't spoil it. If you haven't seen it yet, do so!",dadjokes
"A Gay couple decided to adopt daughter, one got jealous","He said:
""Your daughter calls me daddy too""",dadjokes
An egg got late to work. He says to his boss:,"""Sorry boss, Omlette.""",dadjokes
What do you do to a murderous egg?,You egg-secute it!,dadjokes
Knock knock? Who’s there. It’s Mr Hankeep!,Howdy Ho!,dadjokes
Christmas is ruined!,I've just seen Chris Rea get off a train,dadjokes
Why doesn't Mrs. Claus have any kids?,Because Santa has 3 hoes,dadjokes
"I am scared of small, festive grottos.",I am Santa Claustrophobic,dadjokes
"A man in a watch store decided to buy a watch, but wanted it sprayed with Matte.","""Not on my watch"" said the store clerk.",dadjokes
What did the father buffalo say to his son when he left to school ?,Bison,dadjokes
How do you know Santa is a pimp?,He always yells HoHoHo,dadjokes
Is it a dad joke when your daughter tells it?,"My 11 year old to my 9 year old, as we drive by a cemetery on a hill : ""i wonder why they bury people in a hill.""

9 year old, in total deadpan: ""because they're dead.""",dadjokes
Why don't they ever charge Santa for break and enter?,They can never find probable Clause,dadjokes
We can’t allow this year to end!,That would be admitting 2021.,dadjokes
At first there were only 25 letters,No one knew why,dadjokes
If Emily gets depantsed in front of her friends...,She’s em-bare-assed on 2 levels,dadjokes
Asked my kids this morning to bring their laundry and separate it into whites and colors. My son holds up some grey sweats and asks which pile.,"My response: Not sure son, that’s kind of a grey area.",dadjokes
Did you know Santa has a tenth reindeer named Olive?,They mention it in Rudolf’s song when they say “Olive the other reindeer”.,dadjokes
What do you do when you see a space man?,"Park in it, man!",dadjokes
The old man would be proud,"My oldest this morning as he brushed by me on the way to the bathroom:

“I have to take a pee”

Me: 

“Why don’t you leave one instead?”

The look I got: “🤨”",dadjokes
"Whats the difference between girls/women aged 8, 18, 28, 38, 48, 58, 68 and 78","At 8. You take her to bed and tell her a story. 
At 18. You tell her a story and take her to bed. 
At 28. You don't need to tell her a story to take her to bed. 
At 38. She tells you a story and takes you to bed.
At 48. She tells you a story to avoid going to bed.
At 58. You stay in bed to avoid her story. 
At 68. If you take her to bed, that will be a story.
At 78. What story??? What bed??? Who the hell are  you ???",dadjokes
My wife and I have split up because of psychological reasons....,She's a bloody psycho and I'm logical.,dadjokes
What do you call it if you die from eating too many chickpeas?,Hummuscide,dadjokes
I'm 15 but I have the body of a 6 year old.,"No seriously, he's in the freezer.",dadjokes
Did you hear about the well-dressed TSA agent?,He was stylin’ and profilin’.,dadjokes
What's an alternative name for a pregnancy test ?,Maybe Baby.,dadjokes
What’s Santa’s favorite SUV?,"

A Taho-ho-ho!",dadjokes
My brother was addicted to the Hokey Pokey...,But luckily he turned himself around.,dadjokes
What do you call a Jedi horse?,Unbridled force.,dadjokes
What’s it called when you tickle a man to death by accident?,Manslaughter,dadjokes
What do you call when someone steals a spiny anteater from the zoo?,Echidnapping...,dadjokes
There's one job I could see myself doing,Making mirrors,dadjokes
I get it emotional after every bar of chocolate,The last bite is always bitter-sweet,dadjokes
What's the difference between a hippo and a zippo?,"One is really heavy, the other is a little lighter.",dadjokes
I was at the grocery store the other day getting flour,"When a guy walks up next to me and grabs some yeast.

So I said, ""A man of culture, I see!""",dadjokes
I got 1st place in a context i participated in where the prize would be unlimited access to HBO.,My disappointment was immeasurable when they presented me with a lifetime supply of Honey Bunches of Oats.,dadjokes
"Thought I only had to take a piss, so I didn’t bring my phone.",I didn’t sign up for this shit.,dadjokes
Are you Jamaican?,Because you’re Jamaican me crazy,dadjokes
Went camping with a time traveler but they were silent the whole time...,...I think they prefer speaking in future tents,dadjokes
The nation of Iran lies between the ancient lands of Babylon to the west and the mountains of Afghanistan to the east...,"In other words, it’s between Iraq and a hard place.",dadjokes
"When Ludwig van Beethoven died, he left a letter in his will...",...it was für Elise,dadjokes
I recently overpaid for my vascectomy.,What a rip-off,dadjokes
whats a good way to get fake popular points?,cake :),dadjokes
Which pasta gets locked out of the house? —Technically a wife joke.,Gnocchi.,dadjokes
Why does the Norwegian navy have barcodes on the sides of their ships?,So that when they arrive back to port they can Scandinavian,dadjokes
My wife alphabetized our cutlery.,Weird how she is always giving me Fork U.,dadjokes
Why did the legally blind guy fall into the well?,Because he didn’t see that well.,dadjokes
What do Europeans eat instead of enchiladas?,25.4 millimeter-eladas,dadjokes
Wood fired Pizza,How is Pizza going to get a job now?!?,dadjokes
Albino dalmatian,"On my way to work this morning i spotted an albino Dalmatian, i figured it was the least i could do for him.",dadjokes
"The wife, taking a selfie with the kids: ""Cheese kids!""","Me: That's a common mistake, but they're actually real kids.",dadjokes
I don’t think Mary and Joesph ever got a divorce,It was a pretty ***stable*** relationship,dadjokes
Why is it a bad idea to fight Santa?,".
.
.
Cause he's got a black belt",dadjokes
"The salesman at the furniture store told me, “This sofa will seat 5 people without any problems.”","I said, “Where the hell am I going to find 5 people without any problems?”",dadjokes
What do you call a software update on an iPhone or and iPad?,An iPatch,dadjokes
What's common between strippers and giants?,"

They both grind men's bones to make bread",dadjokes
"I kinda wish I was a teacher or some business executive leading one of these Zoom calls, because as soon as everyone popped up in their little box on screen I’d start off by saying:",“Hey you guys are a lot smaller than I thought you’d be”,dadjokes
You know why appoint wants rappers to reach their fan's exceptations?,[deleted],dadjokes
Why do the young like electronic things?,It's more current,dadjokes
So a guy is walking down the street. He gets shoved by an absolute stranger and falls off a bridge...,"He lands into a water tank labeled “Sodium Chloride.”

Guy swims up through the cloudy white fluid.

Gasping for air he shouts up to to stranger that shoved him:

“Why did you do that?! Now I feel in-salt-ed!”",dadjokes
This year has been pretty terrible,Next year is looking better. Unfortunately the one after that is going to be Twenty Twenty too.,dadjokes
What kind of self defence do vegans use?,Tofu,dadjokes
What did the cannibal call the curry he made using the meat of Joshua - a balding Indian man?,Rogaine Josh,dadjokes
Some rat b****** Mother F***** piece of S*** son of a b**** ruined my mushroom batch.,"I'm so sorry about that, I have bad morels.",dadjokes
your mom secretly told me that you were born on a highway,....that's where most accidents happen,dadjokes
"My wife was hurrying me along and asking when things were going to be done so I asked her if she was my clone from Moscow. She looked confused and said ""No, why?""","I said ""Because you're Russian me.""",dadjokes
What do you call the bass in dog choir?,A subwoofer,dadjokes
What type of overalls does Mario wear?,Denim denim denim.,dadjokes
Why do stories have plot holes?,"
Like the holes in a container,

To let the the characters breathe and live.",dadjokes
How do you know that a Hurricane is is definitely female?,When she comes it’s wet and moist and she gives a mean blowjob... then takes your how and your car!,dadjokes
I tried to make jokes about the millions unemployed and out of work.,"Sadly, they never work.",dadjokes
"I told a dad joke to my grandma, and she asked if I made it up",[deleted],dadjokes
"I told my grandma a dad joke, and she asked if I made it up"," I said “nah, I just Reddit”",dadjokes
A man walks into Ikea,"And he goes up to the most beautiful worker and says ""hi, I'm looking for uh, one night stand""",dadjokes
What do you call paramedics in a rock concert?,Band aid,dadjokes
I was going to get up...,But then I put my foot down and decided there will be no more of that around here.,dadjokes
"Jesus wanted to say something new on Christmas. It was supposed to be a whole new sentence ,",But instead he just Santa Clause.,dadjokes
Great artists have great sense to pick out matching colors, call it color palate,dadjokes
What do ants take to get high?,Antacid,dadjokes
Did you hear about the Swedish car company that went bust in 2012?,It’s your typical Saab story.,dadjokes
my friend bit me and told me I was transgender,"so I said “oh wow, I didn’t know it could transpire”",dadjokes
what did the mexican firefighter call his first son?,"Hose A

what did he call his second son?

Hose B",dadjokes
I have a dancing fish,The only problem is that it only does it once and lasts about 20 seconds,dadjokes
Why did the scarecrow get an award?,Because he was outstanding in his field,dadjokes
"This year for Christmas, im going to buy a map for Chris Rea ...","He seems a bit lost, he's been driving home for Christmas since 1986",dadjokes
Yesterday I had a fight with my friend at his house. We started drinking whiskey. Jack Daniels 🥃,Now everything is ok but his dining table legs are gone!! 🤔 All 4 of them!!,dadjokes
Why did the computer crash?,It had a bad driver.,dadjokes
"Since the very beginning, man has been panning for gold and using it as trade.",Our ancestors called it the prime-ore-deal soup,dadjokes
"Thought it best to be blunt with my son, ""I remember when I first started using drugs. I was 18 years old. It all started with a spliff, the odd bong or two. Before I knew it, I'd started using amphetamines like speed and for a stronger buzz, I moved on to ecstasy.""","""It wasn't long after, that I started on the hard stuff, like cocaine and heroin. I was a complete mess. I was broke and my body was ruined. But man, oh what a night!""",dadjokes
My 11 year old: Who is the leader of all tissues?,The handkerchief,dadjokes
Mattel is now making the Divorced Barbie doll.,She comes with all of Ken's things.,dadjokes
I thought I was indecisive,But now I’m not too sure.,dadjokes
You thought 2020 was bad?,Wait until it turns ‘21 and can start drinking.,dadjokes
"An amazing chef works at a Chinese restaurant and specializes in wok dishes. One day, the kitchen catches on fire and he burns to death. All of a sudden, a ray of light shines onto the ashes and he is reborn.",I guess you can call him Wok King Phoenix.,dadjokes
Never run with bagpipes,"You could put an aye out, or worse yet, get kilt.",dadjokes
What do you call a sick bird from Mars?, An ill Eagle alien,dadjokes
"Pro tip: If you are looking for a cheap way to work out at home, consider using milk jugs as weights.","But be sure to use almond or soy milk, I’ve heard they’re the healthier alternatives.",dadjokes
What part of the body always loses?,Defeat,dadjokes
How do gold fishes get old?,Take away the G,dadjokes
"The first time I saw her, at her honey stall at the farmers market, I knew right away...",...she was a keeper.,dadjokes
Do Hawaiians laugh out loud?,Or is it just a low ha?,dadjokes
My friend asked if I was certain Britain was an island,"I told him ""100% shore""",dadjokes
I told a joke to a cow.,He was very amoozed.,dadjokes
I want to open a Chinese food buffet,"It will be called ""All You Can Eat and Dim Sum""",dadjokes
My wife was kidnapped by a mime,He did unspeakable things to her,dadjokes
Thought I heard someone say “Hello” in Arabic,But it was a false Salaam.,dadjokes
Apple made a calculator,,dadjokes
What is Marios overalls made of?,"Denim, denim, denim...

My son surprised me with that one today.",dadjokes
What do you call a lazy doctor?,Dr. Do Little,dadjokes
I will never be part of a car safety test,They are filled with a bunch of dumbies,dadjokes
I heard you can tune a piano,But can you tuna fish?,dadjokes
What's better than have a rose on your piano?,Having Tulips on your organ.,dadjokes
"Wife: ""Can you clear the table.""","I had to get a running start, but I managed it.",dadjokes
[NSFL] I feel like a blind porn star......,Never saw it coming.,dadjokes
"I was on the bathroom scales, sucking my stomach in.","Thinking I was trying to weigh less with this manouver, my wife commented, ""I don't think that's  going to help !!""

""Sure it does "" I retorted ""It's the only way I can see the numbers.""",dadjokes
Did you hear about the fashionable scientist who can design your baby to your specifications?,They are always bragging about their designer jeans,dadjokes
I love Vikings,They gave us Bluetooth.,dadjokes
A woman was on trial for beating her husband to death with his guitar collection,"the judge says: ""First offender""  The woman replies: ""No, first a Gibson, the a Fender""",dadjokes
An ice-cream van overturned in our road....,"Avoid the area,  as it has all  been coned off.",dadjokes
I just had a german joke about the USSR during WW2...,Aber jemand stalingrad,dadjokes
What do you drink if you are only a little thirsty in Minneapolis?,A Mini-soda!,dadjokes
So I wanted to withdraw some money.,Have to try again later because for some reason I can‘t ATM.,dadjokes
I have been reading this new anti-gravity book.,It's so good that I can't put it down.,dadjokes
This sub is like a dairy farm,I’ve herd it all before,dadjokes
What did the pirate say when he turned 80?,Aye Matey,dadjokes
A guy got two dogs and named them One and Two. One has unfortunately escaped.,"But it's ok, he still has Two left.

(Thanks for the joke, dad).",dadjokes
Beauty School would actually be very easy to procrastinate in,Because it has make up exams.,dadjokes
Who always gets blamed for letting the farm animals out of their pens?,The escapegoat.,dadjokes
My wife told me about her hard day. That's when I knew she was the imposter...,She vented.,dadjokes
What do you call it when a Indians wants peace?,Naan violence,dadjokes
There's no justification for holding a knife while flirting,Not even if it's a boning knife.,dadjokes
A youth soccer team that won gold at a tournament also stopped a thief that same day.,And he would have gotten away with it if it weren't for those medalling kids.,dadjokes
Guys this is not a drill!,It’s actually a screwdriver,dadjokes
How do you turn a fox into a cow?,Get married.,dadjokes
Why was the snowman rooting around in a bag of carrots?,He was picking his nose.,dadjokes
Tree joke,"Did you hear Santa got charged for flying around the yew forest?
He was charged with evasion of taxus.",dadjokes
How does a T-Rex feel after working out?,"Kindasoar. 


Boyfriend told me this after we discussed our workout today 🥲",dadjokes
When I have expensive medical bills -,Does that mean I had a valuable experience?,dadjokes
What do you call it when Indians want peace,They want to be Naan Violent,dadjokes
How profoundly disappointing to know...,...that the band 'Toto' was not made up of former members of the band 'Kansas'.,dadjokes
What did the pirate say on his 80th birthday?, Aye Matey!,dadjokes
My grief counsellor died the other day..,"He was so good at his job, I didn’t give a shit.",dadjokes
I went to the first meeting of my premature ejaculator’s support group this morning..,Turns out it’s tomorrow.,dadjokes
I ran into this vegan girl who said she knew me,I had to tell her I'd never met herbivore.,dadjokes
"Old Farmer: If you want your crops to grow, you must remember to fertilize your land properly.","New guy: That sounds like bullshit.

Farmer: Yes, exactly.",dadjokes
"Today I saw an ad that said ""radio for sale, $1, volume knob stuck on full.""","I thought, ""I can't turn that down.""",dadjokes
Two oranges were sitting at a bar,"One says to the other ""Your round""",dadjokes
Saw an Ad for a radio..,[deleted],dadjokes
Who delivers presents to baby sharks at Christmas?,Santa Jaws,dadjokes
What genre are national anthems?,Country,dadjokes
I gave a flat battery away today.,Free of charge.,dadjokes
My wife was complaining that I never buy her jewellery.,I didn’t even know she sold jewellery.,dadjokes
Man did the world just discover navigation?,Because there seems to be a lot more MAPS around,dadjokes
Last month I launched a book aimed at children.,I’m pleased to say I hit one of them,dadjokes
What's an egg worth?,One buk.,dadjokes
"Foot massages,",they're good for the sole.,dadjokes
What do you call a ghost asking for the manager?,I don’t know what to call it!!!! It keeps s-Karen me!!!!,dadjokes
My girlfriend asked me to tease her.,I said ‘no problem fatty’,dadjokes
"Werewolf: half man, half wolf...","Werehouse: Half man, half house",dadjokes
A farmer said to me “I have 68 sheep. Can you help round them up for me?”,I said sure.  70.,dadjokes
A valet gets sucked into a worm hole and finds himself in an alternate universe.,"The universe is almost identical. He soon manages to find an apartment and a job. 

First day at work, he grabs the keys from a customer and just as he’s about to peel out for the parking lot, when he realizes, there isn’t one.

He yells out to his co-worker “Hey! Where’s the parking lot? I only see street parking?!”

The other valet yells back “What else would there be? It’s parallel parking!”",dadjokes
What do you call a vegan dog?,An ambulance.,dadjokes
Apparently you can’t use ‘beefstew’ as a pass word,It’s not stroganoff,dadjokes
I apopted a dog from a blacksmith today,As soon as I got it home it made a bolt for the door,dadjokes
What do you call a French man being mayled by a lion?,[deleted],dadjokes
Did you hear about the guy who makes comics out of tiny colourful plastic discs?,He is a sequintial artist.,dadjokes
How do you get Dick form Richard?,,dadjokes
I held an orgy for time travelers yesterday.,I'm the only one that came.,dadjokes
Whycan’tastronaughtsgetdrunk?,...becausethere’snospacebar.,dadjokes
What did the father fish say after he found his missing daughter?,,dadjokes
Knock knock...,Oh it’s just the Mormons again,dadjokes
What do you call HULK when he is not dieting?,BULK,dadjokes
I once had a job pressing soda cans,,dadjokes
What did Homer say to Bart when Bart was getting too obsessed with a girl?,"""You're a simp, son!""",dadjokes
Whats a dual side-effect of the VID19?,Coffin,dadjokes
What do you do when your eyes are dry?,Moisturize,dadjokes
"""What kind of shoes do ninjas wear?","First Trainers, then Sneakers!""",dadjokes
I wish I was an expert at tying ropes together,but I’m knot,dadjokes
What do you call a plane that’s never flown before?,A Virgin.,dadjokes
I was once kidnapped by mimes.,They did unspeakable things to me.,dadjokes
A “P P” in a “V V”,Is a baby-bab-ay,dadjokes
testing,testing,dadjokes
Why do elephants have trunks?,Because a suitcase is just not enough,dadjokes
