title,selftext,subreddit
A man walks into a bar after a long day at work.,"He sits down, orders a beer, and begins to mull over his day.

After a few minutes he hears a quiet, and high pitched voice say ""I like your shirt"".  He looks around and doesn't see anybody, so he goes back to his drink.

A few sips later he hears the same voice say ""You have lovely eyes"".  He looks around again half expecting to see Alvin the chipmunk, but there is nothing.

After a few more sips, he hears it again, ""I bet your parents are real proud of you"".  Finally he has had enough.  He slams his drink down, looks over at the bartender, and says ""what the hell is that high pitched voice I am hearing?!""

The bartender looks up and says ""Its the peanuts...

They're complimentary.""",dadjokes
Cigarettes after sex helped me....,....to quit smoking.,dadjokes
"Me to cop: ""You cant arrest me.I have a marathon to run.""","Cop: ""Stop playing the race card.""",dadjokes
Trump : Nothing is built in America anymore....,".....I just bought this new t.v. and it said, ""Built in Antenna"" I don't even know where that is!!",dadjokes
Me: I me this girl with a dozen breasts My friend: that sounds strange...,Me: dozen tit?,dadjokes
"The power went out when I got my COVID vaccine, and I got lost in the building.","It was a shot in the dark, but I found it!",dadjokes
Chocolate ice cream,Working at an ice cream parlor there was a customer that insisted I serve him chocolate ice cream even though we were out of it. He just wouldn’t give up. So I said “let’s play a game”.  How many “vans” are in vanilla ice cream? -he said “one”(correct) So how many “straws” are in strawberry ice cream? He said “one” again (correct) So then how many “ F’s” are in chocolate ice cream? He said there is no “F” in chocolate ice cream - I said “Exactly- THERE IS NO F IN CHOCOLATE ICE CREAM!!!,dadjokes
Poor Timmy,,dadjokes
Some cows were caught smoking weed an playing poker.,"Yes, the steaks were very high.",dadjokes
Why do mountains make good comedians?,Because they're hill areas...,dadjokes
It's days like these I remember what my Grandad said before he kicked the bucket...,"He said ""Hey, watch how far I can kick this bucket.""",dadjokes
Jim Carrey is combining the movies where he plays God and a pet detective,Alrighty Almighty,dadjokes
"I keep begging my wife to wear pretty dresses, but she just ignores me.",I guess she wears the pants in the relationship.,dadjokes
"After years of trying, a woman tells her husband she is pregnant.","The man, tearing up, takes his wife's hand and says, ""Hi, Pregnant. I'm going to be a dad.""",dadjokes
I’ve got this awful disease where I can’t stop telling airport jokes,My doctor says it’s terminal.,dadjokes
"Everyone knows The Beatles, but do you know The Laundry Beatles?","It's members are

Paul McCottoney, John Linen, Ringo Starch

... And George Harrison.",dadjokes
You really got to hand it to short people...,Mainly because they can't reach it themselves.,dadjokes
Straw,There was one more.,dadjokes
What did the cake say to the fork?,You want a piece of me!?,dadjokes
I'm reading a horror book in braille.,Something bad is going to happen. I can feel it.,dadjokes
Top ten sources of static electricity...,Number 7 will shock you,dadjokes
Do you think lizard people...,are on Santa's Illuminati list?,dadjokes
What do you get when you have 50 pigs and 50 deer?,100 sows and bucks.,dadjokes
I had chicken for dinner..,My farts have been pretty fowl.,dadjokes
"I didn't say my ex-wife died,",I said I have a latex wife.,dadjokes
I have been happily married for 15 years,I’ve been married for 36.,dadjokes
Why did the frog drowned itself?,It wanted to Kermit suicide.,dadjokes
I tried to make a dad joke,[deleted],dadjokes
Just so everyone is clear,I'm gonna put on my glasses,dadjokes
Why do tectonic plates have to wear diapers?,Because they struggle within continents.,dadjokes
"If you were a russian when you went in the bathroom and a finnish when you left, what were you in the bathroom?",European,dadjokes
"Proud!! I just put a puzzle together, it only took 2 days.",Box said 2-4 years,dadjokes
Massive protest spread across Madrid earlier today to protest the nation's Supreme Court ruling that bans tattoos.,Nobody accepts the Spanish ink decision.,dadjokes
Tiger Woods says he'll play and win this year's Masters Tournament...,He said he's got a leg up on the competition.,dadjokes
I was going to post a great incontinence joke...,...but it's already been leaked.,dadjokes
What's the opposite of disappoint?,[deleted],dadjokes
Someone once told me,,dadjokes
Where does Smokey stay when he goes on vacation?,Bear BnB,dadjokes
Denmark is the only country in the world that has a “Den” at front &amp; “mark” at the end.,N O   W A Y.,dadjokes
What is the hardest cult to join?,The diffi-cult,dadjokes
You know what’s the worst thing about keeping an open mind?,You’ll end up getting a splitting headache.,dadjokes
I never thought I would say this,Vshdoskf,dadjokes
"A three year old girl who is going to inherit her father's hotel chain, playing with modeling clay, wearing a Manchester united shirt over a Diego Maradona shirt, had a sudden realization.",[deleted],dadjokes
Why can't Barbarians keep their hands off their axes?,All that cleavage.,dadjokes
Who does Thor trust to protect his back against the Frost Giants?,Asgardians,dadjokes
Whatkind of whine is the best dancer?,Chardonnae-nae,dadjokes
What is the most victorious season?,"(My 11 year old daughter thought of this) 

Winter",dadjokes
What do you call a computer that plays tennis?,A server,dadjokes
Two antennas got married.,The reception was wonderful.,dadjokes
"My wife came home from work stressed out from her day. I asked her how I could help, she asked me to draw her a bath.","I showed her the drawing I made, she replied “that wasn’t really what I had pictured...”",dadjokes
What do you call a careful wolf?,,dadjokes
A sailor walks into a thrift store after he lost a limb to a giant octopus,"He said “I heard this is a second-hand shop, where they at?”",dadjokes
The creator of the knock-knock joke should get a Nobel prize,,dadjokes
Did you hear FedEx and Ups are merging?,Fed Up,dadjokes
What's a canadian favorite singer?,Billie ehh-ilish,dadjokes
How do you make an ale pale?,Add P,dadjokes
Dad Ventures Spoof Trailer,https://youtu.be/DqhnpGBVcZE,dadjokes
What is God's version of Barbasol called?,,dadjokes
I'm flying to Florida today. Best part about the plane is,it can take off Or lando,dadjokes
I saw a titanic iceberg and thought...,lettuce feast.,dadjokes
Tiger Woods in a massive car crash.,Should have used the driver.,dadjokes
I wanted to be more healthy so tried putting oat milk in my tea.,But it was just too OTT.,dadjokes
Straw. Straw. Straw. Straw. Straw. Straw. Straw. Straw. Straw. Straw. Straw. Straw. Straw. Straw. Straw. Straw. Straw. Straw. Straw. Straw. Straw. Straw. Straw. Straw. Straw. Straw. Straw. Straw. Straw. Straw. Straw. Straw. Straw. Straw. Straw. Straw. Straw. Straw. Straw. Straw. Straw. That's it.,,dadjokes
[NSFW] Why do we call it anal bleaching,"And not ""Changing Your Ring-Tone""?",dadjokes
Why did the clock go back four seconds?,Because it was hungry,dadjokes
What does a critic say at a funeral?,Good mourning,dadjokes
People are usually shocked,When they find out I'm not an electrician.,dadjokes
I always keep an extra pair of gloves with me in the winter,They’re just a good thing to have on-hand,dadjokes
What is black and really long?,,dadjokes
I sure hope Elon Musk doesn't get into a scandal., Yeah. Elongate could stretch out forever.,dadjokes
What do you call a T-Rex who has a sex change operation?,Alice-saurus.,dadjokes
How do you find a blind man at a nude beach?,[deleted],dadjokes
What did one fish say to the other fish?,How should I know? I dont speak fish,dadjokes
Q: Why don’t people starve in the desert?,A: Because you can eat the sand which is there.,dadjokes
How have we not improved on margarine more?,I can't believe it's not better.,dadjokes
Now that I work for Energizer...,"....I feel, soon I'll be in charge.",dadjokes
I met a microbiologist yesterday...,He was bigger than I imagined.,dadjokes
"I ain't bragging, but I've just passed my Paintball test with flying colours.",,dadjokes
I asked my pet mouse why he looked so sad.,He learned he was lactose intolerant.,dadjokes
There's just no reason for women to behave the way they do when they're on their period....,Total ovary action.,dadjokes
Too soon?,[deleted],dadjokes
Why didn't the lifeguard save the drowning hippie?,"Because he was too Far Out, Man 🤙",dadjokes
"I rely on hotels so much,",I've actually become quite inn-dependent.,dadjokes
Tiger Woods was in a car accident this morning...,I heard he hit a birdie.,dadjokes
I like doing multiplications,Sum times.,dadjokes
I prefer eating my vegetables in silence.,I just want some peas and quiet.,dadjokes
Can't seem to get a job in the Covid Era...,I think I have hired immunitity.,dadjokes
What should you do if life gives you melons?,Get your eyes checked.,dadjokes
I love messing around with Americans.,[deleted],dadjokes
I met a pessimistic photographer the other day...,He wouldn’t stop talking about negatives.,dadjokes
I heard that Tiger Wood's accident was cause by a problem with is tires.....,[deleted],dadjokes
I heard that Tiger Wood's car accident was caused by a problem with his tires...,He had a hole in one.,dadjokes
Did Texas survive last week’s winter storms?,Burrrrrrrrrrrrrrly,dadjokes
If a bunch of people simp for someone....,....do they become a simphony?,dadjokes
Making church offerings is dangerous for your wallet,Paying tithing just decimates your income,dadjokes
Of all the inventions ever made in the world...,,dadjokes
I fell into a giant seasoning processor,Now I'm parsley disfigured,dadjokes
I taught my cat to speak and ask her why does she hate vacuum cleaners.,“They suck” said the cat.,dadjokes
Of all the inventions ever made...,,dadjokes
My wife is actually Afraid of all the attention I give her.,[deleted],dadjokes
How do you get around if you don't have legs?,Army crawl.,dadjokes
There's a new band out called The 640 MB,But they still haven't gotten a single gig.,dadjokes
What has 2 butts and kills people?,"An assassin 

Thank you! I’ll be here all night",dadjokes
If you are what you eat . . .,. . . then my cats are paté animals.,dadjokes
Have you heard about the new corduroy pillow?,It’s making headlines!,dadjokes
What’s a iron bars favorite music genre?,Metal,dadjokes
I told my girlfriend I was making a car out of spaghetti.,She told me to grow up and stop being an idiot. You should have seen her face as I drove pasta.,dadjokes
My friend refused to admit that he couldn't catch any African fish.,He was in denial.,dadjokes
"Did you hear about the guy who only dated women named Esther, sometimes more than one at a time?",He identified as poly-Esther,dadjokes
What's something a drug dealer would never ask?,"""Is Pepsi okay?""",dadjokes
I asked my Scottish dad if he likes Oriental food...,"... and where he likes to get it from?

&amp;#x200B;

He said, Och Asian Alley.",dadjokes
Why do birds sit on their eggs?,Because they don’t have chairs,dadjokes
I ran over a nail and popped my tire when my wife and I left the farmers market.,I should have bought asparagus.,dadjokes
What's the weakest part of Tiger Woods game?,Driving,dadjokes
9yo shared this one with me: What do you call a cow who just had a baby?,"De-calf-inated!

Edit: it's been pointed out some people pronounce calf as cālf, so its taking a second. Pronounce it like decaffeinated coffee.",dadjokes
"My sister prefers taking the stairs, but I always take the elevator.",I guess..we are raised differently.,dadjokes
What's another name for a chicken testicle?, Fowl Ball,dadjokes
What's your new years resolution?,Mine's 1920x1080,dadjokes
Why did the Norwegian navy put barcodes on their boats?,[deleted],dadjokes
Which of King Arthur’s Knights built the round table?,[deleted],dadjokes
Why do cows have hooves instead of feet?,[deleted],dadjokes
What do you say when someone's helicopter crash?,Kobe!,dadjokes
In college I took a class on braille.,The professor said we'll probably touch on everything.,dadjokes
"I ordered a beer and the bartender said ""Sorry, I only have root beer.""",So I had him put it in a square glass.,dadjokes
Dad joke but.. I'm a mother..,"What Job did Beethoven get after he died?

He decomposed.",dadjokes
Looks like Tiger Woods is...,[deleted],dadjokes
I once new a hooker. I asked her how she liked her job.,"She said m eh. There’s a lot of coming and going.  

It’s an an in and out type of job.

Edit; knew* thank you.",dadjokes
Jewel thief with worlds worst stutter was jailed for 10 years yesterday...,A police spokesperson says it may take him up to 11 years to finish his sentence.,dadjokes
What do you call a spicy lesbian couple?,[deleted],dadjokes
"Magical Creatures Rights Activist: Sir, are you aware of how wizards and witches deal with Boggarts?",It’s riddikulus!,dadjokes
What do you get when you cross an elephant and a farm?,Squashed.,dadjokes
Why was the Pepsi employee arrested?,,dadjokes
What do you call a priest in a maternity ward?,Father,dadjokes
Why don't female skydivers where tampons?,So they don't pull the wrong string,dadjokes
What did Bob Ross's employees call him for short?,Boss,dadjokes
Who was the 1st person to win the Nobel Prize?, Same person who invented the Door Knock...,dadjokes
What did the mountain say to the funny highlands?,You're hill areas,dadjokes
What are the strongest days of the week?,"Saturday and Sunday.

The rest are weak days..",dadjokes
Why can't a leopard hide?,Because he's always spotted.,dadjokes
What is the perfect 's' word,Sword,dadjokes
What did the drummer call his twin daughters?,"Anna one, Anna two!",dadjokes
Have you heard of the dinosaur pharmacist?,,dadjokes
Tricity was shocked she won the election.,There was electricity in the air.,dadjokes
I love the Lion King..., ...but Simba is so slow. Sometimes I wish he'd Mufasa.,dadjokes
How did the big hairy gay man pass his final exams?,He was smarter than the average bear.,dadjokes
What is a crow’s favorite drink?,Cawfee,dadjokes
"Some people are blessed with dark humor,",and there are those with dead jokes.,dadjokes
Which member of the Wu-Tang Clan has the most carbohydrates?,Toastface Killah.,dadjokes
What Is Roger Federer's Favorite Time Of The Day?,Around 10ish.,dadjokes
Which is the music instrument that Samurai Jack despises the most?,The Akustic Guitar.,dadjokes
"I was watching my brother play the new super Mario 3D world and got so upset with his continued magma dip deaths,",“For the lava god! You’re running out of lives!”,dadjokes
What is a clocks favorite spice,Thyme,dadjokes
Did you hear about the disabled guy who vacuumed his entire house?,Apparently he sucked at it.,dadjokes
A cheese factory in France exploded,There is de Brie everywhere,dadjokes
Dad joke,,dadjokes
My wife was going to pick up some fresh vegetables. She saw a sign that said framers market left.,[deleted],dadjokes
What did the grape say after the elephant stepped on it?,"Not much, it just let out a little whine.",dadjokes
A midget stole my anti-depressants today,Well I hope he's happy...,dadjokes
"Husband turns to his wife and asks "" why do you smoke after sex?""","She replies , ""to make it satisfying""",dadjokes
You don't really hate cats....,You just can't handle rejection.,dadjokes
"Found this one in the wild, wanted to make sure it didn't go unappreciated",,dadjokes
"Found this one in the wild, wanted to make sure it got properly appreciated",https://www.reddit.com/r/MapPorn/comments/lo7cl2/oc_what_countries_in_the_americas_call_their_main/go5w84r/?context=4,dadjokes
I'll never forget my grandfather's last words before he kicked the bucket,"""Do you wanna see how far I can kick that bucket?""",dadjokes
How can you tell that cats are smarter than dogs?,You'd never get 8 cats to pull a heavy sled through snow.,dadjokes
My wife tells me not to listen to the voices that bring me down and make me feel worthless.,She also complains that I never listen to her.,dadjokes
A police officer was fired shortly after leaving the bathroom.,"He was upset about being fired, but happy to be relieved of doody.",dadjokes
Soy milk,Is the only food that tells you what it is.,dadjokes
I love my furniture...,Me and my recliner go way back.,dadjokes
What do you call 2 birds stuck together?,Velcrows.,dadjokes
"Child walks past the parents bedroom, peaks inside and mumbles....","""And you want to send me to a psychologist for sucking my thumb.""",dadjokes
I phoned the clinic enquiring about a circumcision.,I got cut off.,dadjokes
I ate a sandwich in the shower,It was a shoarma,dadjokes
"At the local donation center, only one guy donated anything, and it was a box of poop!","But hey, at least he gave a shit.",dadjokes
What do you call a can opener that’s broken?,A can’t opener,dadjokes
(Daughter's joke) Why did the chicken cross the playground?,[deleted],dadjokes
So India is building a new Walmart,"So, here’s going to be a New Delhi







Note: I thought of this joke when I was 12",dadjokes
I'd really like to move to Switzerland one day,I hear the flag's a real plus.,dadjokes
"The thermostat said it was 65,",But I think he’s lying,dadjokes
I think not letting my dog eat water melon is makings her sad.,She's a little melancholy.,dadjokes
Talk about disappointing: Uncle is having a hard time making Auntie climax.,,dadjokes
My uncle always talks about his disappointing sex life...,It always end in an Auntie climax.,dadjokes
"My Grandpa always said ""don't watch your money, watch your health.""","Then one day when I was watching my health, he stole my wallet.",dadjokes
Why are chemists so terrible at telling Dad jokes?,Because all the good ones argon already.,dadjokes
What do you call two Milk Duds fused together?,Milk Dudes!,dadjokes
What's the funniest of all the known elements?,He He He.,dadjokes
"In college, I worked part time as a butcher's assistant.","You know, just to make ends meat.",dadjokes
What do you call an Italian with a rubber toe?,Roberto.,dadjokes
Our favorite Italian chef died recently.,"When we asked her what happened, his wife said ""he just pastaway.""",dadjokes
Where do cow farts come from?,The dairy air,dadjokes
Why did my son use wool on his minecraft airfield runway?,"True story.

My son was excitedly telling us about his minecraft airfield that he was building, and he explained that, among many other details that my brain ignored, he made the runway out of wool. Other son asked why. I was very excited to tell him that it was because asphalt was expensive, and wool was sheep.",dadjokes
What do you call a belt made out of watches?,A waist of time.,dadjokes
Did you know that Atticus Finch was born with a different name?,Subtracticus Finch.,dadjokes
"My computer broke, and my boss told me to take it to the IT guy",So I went outside and threw it in the sewer,dadjokes
Why is a photon able to go so fast?,It's traveling light!,dadjokes
Oxygen called her Mom to tell her she was marrying Magnesium.,"Her Mom shouted ""OMg!!""",dadjokes
How do libraries help keep the books warm?,They give them book jackets!,dadjokes
Where do cows come from?,Their moomies and daddies.,dadjokes
"Did you hear about the son who tried to stab his mother while she slept? Fortunately he missed her with every blow, the knife plunging over and over into the bed.",The police ended up charging him with attempted mattress-cide.,dadjokes
Today I got a suspicious letter allegedly from a Buddhist prison.,It was monk jail junk mail.,dadjokes
Why did the hipster burn his tongue?,Because he drank coffee before it was cool.,dadjokes
What is a vandal's favourite drink?,,dadjokes
Why don't comedians have much trouble eating?, Because everything they do in-jest!,dadjokes
What's the Kraken gonna give you that'll make you laugh uncontrollably?,Ten Tickles!,dadjokes
Elon Musk decided not to move in to Texas,I guess you can say he got **cold feet**,dadjokes
I couldn’t see the tv controller anywhere near me.,It must have been in a remote location.,dadjokes
You should never bother a fat person at a buffet..,They’ve got a lot on their plate..,dadjokes
What do you call gays who don't have sex with each other?,GAYSEXUAL,dadjokes
Where do men in Southeast Asia go to buy neckwear?,Thailand (“Tie Land”),dadjokes
A murderous fortune telling dwarf..., is technically a small medium at large.,dadjokes
How can you tell if an elephant is in your bed?,If your nose hits the ceiling.,dadjokes
What's it called when you have sex with Barry Allen?,,dadjokes
My dad's cholesterol is so high,That doctors call it chomoretrol,dadjokes
Why did the golfer wear two pairs of pants?,In case he got a hole in one.,dadjokes
How do mountains see?,They peak.,dadjokes
What did King Arthur call his sneakiest knight?,Sir Valence.,dadjokes
Why six is afraid of seven?,Because seven ate nine.,dadjokes
"If falling asleep driving a car is sleeping behind the wheel, what do you call falling asleep driving a motorcycle?", Sleep cycle.,dadjokes
"if someone is always organizing things then they have OCD. If someone is always eating things, then they have...",OBCD,dadjokes
What do you call two horses that live next to eachother?,Neigh-bors,dadjokes
My doctor told me to cut down on red meat.,"So, could you brown it up a bit?",dadjokes
Why are AC/DC always so hungry?,Because it’s a long way to the shop if you want a sausage roll.,dadjokes
Why did the house not make it through the snow?,Because it wasn't built with a 4X4!,dadjokes
What was the shy pebbles' greatest aspiration?,To be a little boulder,dadjokes
I think my girl is faithful.,"
She has no male contact on her phone.
Even my name is saved with a aliases.

She is so intelligent too, I used my best friend's phone to call her and she already knew that it was me, she picked and immediately said ""hi sweetie""",dadjokes
A couple of cows were smoking a joint and playing cards.,"
That's right.  The steaks were pretty high.",dadjokes
Why do True Gamerz always wear clean jeans?,They hate filthy casuals.,dadjokes
Adjective for metal is metallic,But not so for iron which is ironic,dadjokes
Why do fish live in salt water?,Because pepper water would make them sneeze.,dadjokes
How can you tell a dad joke is funny?,It becomes apparent...,dadjokes
There is a religious veterinarian who has a strict rule that only one vet can work on large animals at a time,Because it is a sin to co-vet an oxen or donkey.,dadjokes
What’s the best thing about a Buddhist casino?,It’s free Tibet,dadjokes
What do you call a fly with no wings?,A WALK!,dadjokes
What did the pirate say to his optician?,Me eye hurties,dadjokes
Remember that Europe only has a single plus.,That's Switzerland. 🇨🇭,dadjokes
My kids found a kitten on the side of the road,Man it can fart,dadjokes
Why are nuns so predictable?,Because they're creatures of habit.,dadjokes
"I tried to organize a Hide and Seek tournament, but I eventually gave up.",Good players are hard to find.,dadjokes
"Daughter: Hey daddy are you hungry? Me: Yeah, why?",[poistettu],dadjokes
A friend of mine told me he was looking to buy stock in Bose.,I told him it would be a sound investment.,dadjokes
I used to think that an ocean of soda existed...,"But, it was just a Fanta sea.",dadjokes
"When I was younger, I felt like a man, trapped inside a woman body.","Then, I  was born.",dadjokes
"With Texas covered in snow, does that mean...",its Alamo'd?,dadjokes
I asked the librarian if she had any books on paranoia.,"She said ""They're right behind you!""",dadjokes
Have you guys checked the news today?,No rush.,dadjokes
What happens when a brussels sprout eats too much and doesn't exercise?,It gets cabbage rolls.,dadjokes
What causes all the super-yachts to squeeze together in the same tourist spots?,Pier pressure.,dadjokes
What happened when the monster's football game was all tied up?,They went into ogre time.,dadjokes
I heard a duck joke earlier,It really quacked me up,dadjokes
So the nurse brought the proctologist a can of beer.,"“No!”, said the doctor. “I wanted a butt light.”",dadjokes
My wife asked me to take the trash out.,But it already had a date with the recycling.,dadjokes
If you slip and fall in your driveway...,It's your own asphalt.,dadjokes
It’s crazy that Dubai doesn’t show The Flintstones on TV,But Abu Dhabi Do,dadjokes
What kind of zoo has a shih tzu enclosure?,A shit zoo,dadjokes
Who always wins at the army quiz nights?,General Knowledge,dadjokes
What’s the difference between a man riding a bicycle and a scruffy man riding a tricycle?,Attire.,dadjokes
Why did the computer become a waiter?,'cos he was a server,dadjokes
What do you call two crows?,Attempted murder,dadjokes
How did dumb writers communicate in the old times?,Sign Language,dadjokes
Who looks at the ceiling and cheers?,Ceiling fans.,dadjokes
Good news! I made a potion that makes you cry cakes!,However the first person who tried it is still crying endless tiers!,dadjokes
Archeologists will be digging for a lost village near my home. I hope they find some signs of life.,Remains to be seen,dadjokes
What to hear a joke about paper?,Never mind it’s Terrible,dadjokes
"Wife says I won’t get 5 upvotes for this, but... Did you hear the one about the dog and the tree?",They had a long conversation about bark.,dadjokes
Our plumber moonlights as a stand-up comedian.,"He's a terrible plumber, but he really cracks me up.",dadjokes
What is the difference between a cat on a couch and a dim witted cow?,One is a cat loaf and the other is a cattle oaf.,dadjokes
What do you call a book written in prison?,Context.,dadjokes
What's the difference between a $20 steak and a $55 steak?,February 14th,dadjokes
